contributing repository,identifier,title,created,creator,license,digital resource locator,type,language,extent,subject,spatial,description,publisher,isPartOf,full text,Biographical / historical note,Notes,local data 3
Library Company,cassey-album-p-9764,Original & selected poetry &c.,1833-1856,"Cassey, Amy Matilda, 1808-1856","The Library Company images found on this site do not have any known copyright and are intended for personal, educational or research purposes. For those who intend to publish or who plan on using images for commercial projects, please contact the Library Company to acquire publishable quality images as well as permissions to publish. More information on our rights and reproductions services can be found here at http://www.librarycompany.org/collections/rightsrepro/index.htm",http://lcpdams.librarycompany.org:8881/R/-?func=dbin-jump-full&amp;object_id=126548&amp;silo_library=GEN01,physical object,eng,76 leaves and 10 drawings in 1 volume; 28 x 23 cm,"African Americans --Intellectual life--19th century| African American abolitionists--United States| African American educators--Pennsylvania--Philadelphia| Antislavery movements--United States|Poetry | Love | Friendship| Women--United States--Social conditions |Femininity| African Americans--Religion| Flowers | Albums--1830-1860 | Gouaches-- 1830-1850| Watercolors--1830-1850 | Graphite drawings--1830-1850 | Embossed bindings (Binding)--1830-1840 | Morocco bindings (Binding)--1830-1840 |Bowser, Lydia A.| Buffum, Rebecca Maria Northey--1825- | Chew, John |De Grasse, Isaiah G.| Douglass, Frederick--1818-1895| Douglass, S. M. -- (Sarah Mapps) -- 1806-1882 | Forten, Margaretta| Forten, Mary| Garrigues, Elizabeth |Garrison, William Lloyd --1805-1879| Hopper, Anna W| M'Kim, J. Miller--(James Miller)--1810-1874| Payne, Daniel Alexander--1811-1893| Purvis, Patrick Henry,--1817| Purvis, Robert--1810-1893| Purvis, Sarah Forten--1811 or 12-1898?| Reason, Charles L.
 | Smith, James McCune--d 1813-1865 | Stone, Lucy--1818-1893 |Weston, Ann Warren| Whipper, William--1804?-1876|Willson, Emily--1811 or 1812-",,"Friendship album of Amy Matilda Cassey, a middle-class African American woman active in the anti-slavery movement and African American cultural community, containing contributions dating from 1833 until 1856. Contains original and transcribed poems, prose, and essays on topics including slavery, womanhood, religion, friendship, female refinement, death, and love. Also contains drawings, watercolors, and gouaches of flowers and a New York residential street scene. Contributors, many women of the African American elite community, are prestigious reformers and abolitionists active in the anti-slavery, intelligentsia, and cultural community of the antebellum North including Philadelphia, New York, Boston, and Baltimore.
  Contains the following contributions: entry by African American abolitionist Frederick Douglass, dated Philadelphia 1850, about his ""coarse"" contribution in an album of ""refined"" entries; an original sonnet, ""Fallen Bird,"" and essay, ""The Abolition Cause,"" by anti-slavery activist, author, and editor, William Lloyd Garrison, dated Philadelphia 1833; floral watercolors and calligraphed poems by Philadelphia Quaker activist, educator, and artist Sarah Mapps Douglass; essay, ""Moral Reform,"" dated Philadelphia 1834, by Harrisburg businessman and activist William Whipper; calligraphed version of Washington Irving’s poem, ""The Wife,"" by New York African American engraver Patrick Henry Reason dated New York 1839; poem about ""Friendship"" dated 1837 by anti-slavery activist and gentleman, Robert Purvis; prose on faith penned in 1853 by women right’s activist and abolitionist Lucy Stone; floral watercolors, poems and prose on friendship, womanhood, abolition, and remembrance by Philadelphia Female Anti-Slavery Society associates Margaretta Forten, Mary Forten, Sarah Forten Purvis, Rebecca Buffum, Susan C. Wright, and Hannah L. Stickney; memorials to his deceased wife and daughter by Baltimore African Methodist Episcopal Bishop Daniel Alexander Payne written in 1849; and an essay by abolitionist Reverend Isiah George DeGrasse dated Bridgewater 1836. Additional contributions by Baltimore gentlewoman and anti-slavery activist Emily Willson; anti-slavery activist Ann Warren Weston; Philadelphia barber and activist John Chew; abolitionist James Miller M’Kim; University of Glasgow trained activist James McCune Smith; Boston reformer Wendell Phillips; C.L.R., possibly Charles L. Reason, abolitionist and brother of engraver Patrick Henry Reason; A.W.H., possibly Quaker abolitionist Anna W. Hopper, and E.G., possibly Quaker abolitionist Elizabeth Garrigues.",,Forms part of the Dickerson Family Collection.,,"Cassey, an abolitionist, temperance and civil rights activist and founding member of the interracial Philadelphia Female Anti-Slavery Society and the African American literary and science society, Gilbert Lyceum, was the daughter of New York black community leader, Reverend Peter Williams. She was the wife of Philadelphia businessman and civil rights activist Joseph Cassey, and later married Boston anti-slavery lecturer Charles Lenox Remond.","LCP AR (Annual Report) 1998, p. 25-35.",
Library Company,dickerson-album-13859-q,Original & selected poetry &c.,1840-1846,"Dickerson, Martina, 1829?-","The Library Company images found on this site do not have any known copyright and are intended for personal, educational or research purposes. For those who intend to publish or who plan on using images for commercial projects, please contact the Library Company to acquire publishable quality images as well as permissions to publish. More information on our rights and reproductions services can be found here at http://www.librarycompany.org/collections/rightsrepro/index.htm",http://lcpdams.librarycompany.org:8881/R/-?func=dbin-jump-full&amp;object_id=126720&amp;silo_library=GEN01,physical object,eng,"95 leaves, 4 drawings in 1 volume: ink, gouache, watercolor, and graphite; 28 x 23 cm. (11 x 9 in.)","African Americans--Education--Pennsylvania--Philadelphia|African Americans--Intellectual life--19th century|African American educators--Pennsylvania-Philadelphia|Poetry|Love|Friendship|Sympathy |Courage|Femininity|Flowers--United States| Antislavery movements--Pennsylvania--Philadelphia|Albums--1840-1850|Gouaches--1840-1850|Watercolors--1840-1850| Graphite drawings--1840-1850|Embossed bindings (Binding)--1840-1850|Morocco bindings (Binding)--1840-1850|African American abolitionists--Pennsylvania--Philadelphia|African American artists--Pennsylvania--Philadelphia|African American women artists--Pennsylvania--Philadelphia|Forten, James--1766-1842| Douglass, S. M.--(Sarah Mapps)--1806-1882--artist|Forten, James--1816 or 17-|Douglass, Robert M. J.--1809-1887--artist|Douglass, William--of Philadelphia|Hinton, Ada Howell--artist| Bowers, John C.--1810-1873",,"Album belonging to Martina Dickerson, a young middle-class African American Philadelphian, probably created as a pedagogical instrument to promote cultivated expression, with twenty-two contributions dating from 1840 until around 1846. Contains original and transcribed poems, prose, and essays on topics including love, friendship, sympathy, courage, and female refinement. Also includes drawings, primarily of flowers. Identified contributors are mainly black elite intelligentsia active in the African American anti-slavery and cultural community of mid-nineteenth century Philadelphia. Contains the following contributions: calligraphed title page by abolitionist James Forten, Jr.; prose on ""Literature,"" ""The Album,"" and ""The Year"" by entrepeneur and abolitionist James Forten, Sr. or his son, James, Jr.; prose entitled ""Perserverance"" by tailor, abolitionist, and civil rights activist John C. Bowers; prose, sketches, and watercolors by Quaker abolitionist, educator, and artist, Sarah Mapps Douglass; watercolor and transcribed poem, ""The First Steamboat on the Missouri,"" by Sarah's brother, artist, community activist, and abolitionist, Robert Douglass; essay entitled ""Sympathy"" by William Douglass, pastor and historian of the St. Thomas Episcopal Church in Philadelphia; transcription from Wordsworth's ""Excursion"" by educator and anti-slavery activist Charles L. Reason; gouache of a bunch of flowers by A.H.H., probably Ada Howell Hinton, an African American gentlewoman; and prose, poems, and gouache by Mary M. MacFarland, V.E. Macarty, Y.J. Grice, Rebecca F. Peterson, H.D. Shorter, C.D.R., and J.F.V.",,Forms part of the Dickerson Family Collection.,,"Dickerson, a pupil of African American educator Sarah Mapps Douglass, was the daughter of African American activists, Martin and Adelia Dickerson, and step-father Samuel Van Brackle.","LCP AR (Annual Report) 1993, p. 17-25.",
Library Company,dickerson-album-13860-q,Album,1833-1882,"Dickerson, Mary Anne, 1822-1858","The Library Company images found on this site do not have any known copyright and are intended for personal, educational or research purposes. For those who intend to publish or who plan on using images for commercial projects, please contact the Library Company to acquire publishable quality images as well as permissions to publish. More information on our rights and reproductions services can be found here at http://www.librarycompany.org/collections/rightsrepro/index.htm",http://lcpdams.librarycompany.org:8881/R/-?func=dbin-jump-full&amp;object_id=126802&amp;silo_library=GEN01,physical object,eng,"81 leaves, 7 plates, and 4 illustrations in 1 volume; 25 x 19 cm.","African Americans--Education--Pennsylvania--Philadelphia| African Americans--Intellectual life--Pennsylvania--Philadelphia|Friendship|Motherhood| Mortality--United States|Youth--United States|Death--United States|Femininity|Flowers--United States|Slaves--United States|Antislavery movements--United States|Albums--1830-1860|Engravings--1830-1840 |Watercolors-- 1830-1850|Wash drawings--1830-1840 |Embossed bindings (Binding)-- 1830-1840| Morocco bindings (Binding)--1830-1840|African American artists--Pennsylvania--Philadelphia|Abolitionists--Pennsylvania-- Philadelphia |Forten, Charlotte Vandine|Nell, William C.--(William Cooper)--1816-1874|Buffum, Arnold--1782-1859|Child, Lydia Maria Francis--1802-1880|Durand, Asher Brown--1796-1886--engraver|Douglass, Robert M. J.--1809-1887--artist |Douglass, S. M.--(Sarah Mapps)--1806-1882--artist|Hinton, Ada Howell--artist|Jones, John A.|Purvis, Sarah Forten--1811 or 12-1898?| Webb, Elizabeth Susan--1818-1888|Fielding, C.--artist|Bennett, W. J.--(William James)--1787-1844--artist|Childs, Cephas Grier--1793-1871--engraver|Weir, Robert Walter--1803-1889--artist|Smillie, James--1807-1885--etcher|Cole, Thomas--1801-1848--artist",,"Album belonging to Mary Anne Dickerson, a young middle-class African American Philadelphian, probably created as a pedagogical instrument to promote cultivated expression, with contributions dating from 1833 until 1882. Contains engraved plates depicting scenic views, and original and transcribed poems, prose, essays, and drawings on topics including friendship, motherhood, mortality, youth, death, flowers, female beauty, and refinement. Also contains a one page record of family deaths, marriages, and births with entries up to the birth of Mary Anne’s grandson in 1882. Identified contributors are mainly black elite intelligentsia active in the African American anti-slavery, and cultural communities of mid-nineteenth century Philadelphia, New York, and Boston. Contains the following contributions: ""The Mother’s Joy,"" a poem by C.F., possibly by abolitionist and second wife of entrepreneur James Forten, Charlotte Vandine Forten; illustration after ""The Boroom Slave"" and the poem, ""To the Album,"" by artist and activist Robert Douglass; prose, ""To Mary Ann"", about living a happy life by Philadelphian anti-slavery activist Amy Matilda Cassey; a memorial, ""To My Dear Willie,"" by Mary Anne to her deceased son, William Jones; poem, ""The Night of Death,"" by J.A.J., Mary Anne’s husband, John A. Jones; Boston author and civil rights activist William C. Nell’s transcription of the poem, ""The Rights of Women""; allegorical prose on the meaning of life by New York abolitionist Harriet Forten Purvis; transcription of the poem, ""The Pearl Diver,"" by white Philadelphian anti-slavery activist Arnold Buffum; prose to ""Mary Annie"" about remembrance by Ada, possibly by anti-slavery activist Sarah Forten Purvis or gentlewoman Ada Howell Hinton; floral drawing by A.H.H., probably by Ada Howell Hinton; prose and floral watercolors by educator, abolitionist, and Quaker Sarah Mapps Douglass, the sister of Robert Douglass; ""Lines Addressed to a Wreath of Flowers Designed on a Present for Mary Ann"" by E.S. Webb, possibly Elizabeth Susan Webb, sister of novelist Frank J. Webb; and prose by Mary Anne about mortality. Additional entries of prose and poetry by John G. Dutton, E.S. Webb, Lydia A.B., Henrietta, W.F.P, and S.L.C., unattributed entry, ""To Esther,"" and unattributed entry of a floral watercolor. Also contains engraved plates by A.B. Durand, C. Fielding, C.G. Childs, Robert Walter Weir, James Smillie and Thomas Cole entitled respectively, ""Falls of the Sawkill""; ""Italy, The Bay of Naples""; ""Weehawken""; ""Delaware Water Gap""; ""Catskill Mountains""; ""Fort Putnam""; and ""Winnipiseogee Lake"".",,Forms part of the Dickerson Family Collection.,,"Dickerson, a pupil of African American educator Sarah Mapps Douglass, was the daughter of African American activists, Martin and Adelia Dickerson, and step-father Samuel Van Brackle.","Release of Dower document dated 1838 giving the Dickerson home to the surviving children, contemporary unidentified newspaper clippings, manuscript poetry transcriptions, contemporary greeting cards, tradecard, and other miscellaneous loose items removed and housed separately.","LCP AR (Annual Report) 1993, p. 17-25."